{
  "$schema": "https://json-schema.org/draft/2020-12/schema",
  "$id": "https://engin-code.local/schemas/task-plan.schema.json",
  "title": "Task Plan",
  "description": "任务拆分契约。按用户故事组织任务，但每个 task 必须落到单个固定代码基座和单个 primary skill。",
  "type": "object",
  "required": ["schemaVersion", "planId", "prdId", "status", "storyGroups", "humanApproval"],
  "additionalProperties": false,
  "properties": {
    "schemaVersion": { "type": "string", "const": "0.1.0", "description": "契约版本。当前固定为 0.1.0。" },
    "planId": { "type": "string", "pattern": "^PLAN-[A-Z0-9][A-Z0-9-]*$", "description": "任务计划 ID。" },
    "prdId": { "type": "string", "pattern": "^PRD-[A-Z0-9][A-Z0-9-]*$", "description": "来源 PRD ID。" },
    "status": { "type": "string", "enum": ["draft", "approved", "superseded"], "description": "任务计划状态。只有 approved 可以进入自动执行。" },
    "createdAt": { "type": "string", "format": "date-time", "description": "创建时间。" },
    "updatedAt": { "type": "string", "format": "date-time", "description": "更新时间。" },
    "storyGroups": {
      "type": "array",
      "minItems": 1,
      "description": "按用户故事分组的任务列表。",
      "items": {
        "type": "object",
        "required": ["storyId", "title", "tasks"],
        "additionalProperties": false,
        "properties": {
          "storyId": { "type": "string", "pattern": "^US-[0-9]{3}$", "description": "PRD 中的用户故事 ID。" },
          "title": { "type": "string", "minLength": 1, "description": "用户故事标题，便于执行报告展示。" },
          "tasks": {
            "type": "array",
            "minItems": 1,
            "description": "该用户故事下的可执行任务。每个 task 单基座、单 skill、单职责。",
            "items": { "$ref": "#/$defs/task" }
          },
          "acceptanceChecks": {
            "type": "array",
            "description": "用户故事级验收检查。通常用于跨端流程验证。",
            "items": { "$ref": "#/$defs/check" },
            "default": []
          }
        }
      }
    },
    "regressionChecks": {
      "type": "array",
      "description": "功能级回归检查。通常在所有用户故事完成后执行。",
      "items": { "$ref": "#/$defs/check" },
      "default": []
    },
    "humanApproval": { "$ref": "#/$defs/humanApproval" }
  },
  "$defs": {
    "task": {
      "type": "object",
      "required": [
        "id",
        "title",
        "type",
        "sourceStoryIds",
        "targetBaseId",
        "dependsOn",
        "requiredSkillId",
        "scope",
        "allowedPaths",
        "acceptanceCriteria",
        "checks",
        "contextBudget",
        "retryPolicy"
      ],
      "additionalProperties": false,
      "properties": {
        "id": { "type": "string", "pattern": "^TASK-[0-9]{3}$", "description": "任务 ID。" },
        "title": { "type": "string", "minLength": 1, "description": "任务标题。" },
        "type": {
          "type": "string",
          "enum": ["setup", "schema", "backend", "middle", "client", "integration", "test", "docs", "refactor", "fix"],
          "description": "任务类型。用于 skill 匹配和报告分组。"
        },
        "sourceStoryIds": {
          "type": "array",
          "minItems": 1,
          "description": "该任务服务的用户故事 ID。大多数情况下只有一个。",
          "items": { "type": "string", "pattern": "^US-[0-9]{3}$" }
        },
        "targetBaseId": {
          "type": "string",
          "pattern": "^[a-z0-9][a-z0-9-]*$",
          "description": "目标子项目 ID。必须引用 project.json 的 bases[].baseId。每个 task 只能落到一个项目内子项目。"
        },
        "dependsOn": {
          "type": "array",
          "description": "前置任务 ID。依赖未完成时，该任务保持 pending。",
          "items": { "type": "string", "pattern": "^TASK-[0-9]{3}$" }
        },
        "requiredSkillId": { "type": "string", "minLength": 1, "description": "primary skill ID。每个 task 只允许一个 primary skill。" },
        "scope": {
          "type": "object",
          "required": ["summary", "inScope", "outOfScope"],
          "additionalProperties": false,
          "description": "任务范围。用于限制 agent 不要越界开发。",
          "properties": {
            "summary": { "type": "string", "minLength": 1, "description": "任务范围摘要。" },
            "inScope": { "type": "array", "description": "本任务允许完成的事项。", "items": { "type": "string" } },
            "outOfScope": { "type": "array", "description": "本任务明确不做的事项。", "items": { "type": "string" } }
          }
        },
        "allowedPaths": {
          "type": "array",
          "minItems": 1,
          "description": "允许修改的路径模式。是否强制限制由 orchestrator 策略决定。",
          "items": { "type": "string", "minLength": 1 }
        },
        "expectedChangedFiles": {
          "type": "array",
          "description": "预期会改动的文件。用于 review 参考，不一定穷尽。",
          "items": { "type": "string" },
          "default": []
        },
        "acceptanceCriteria": {
          "type": "array",
          "minItems": 1,
          "description": "任务级验收标准。",
          "items": { "$ref": "#/$defs/criterion" }
        },
        "checks": {
          "type": "array",
          "description": "任务级检查。checks 失败时任务标记为 checks_failed。",
          "items": { "$ref": "#/$defs/check" }
        },
        "contextBudget": {
          "type": "object",
          "required": ["size", "maxFiles", "maxEstimatedMinutes"],
          "additionalProperties": false,
          "description": "上下文预算。用于约束 task 粒度。",
          "properties": {
            "size": { "type": "string", "enum": ["xs", "s", "m", "l"], "description": "任务尺寸。建议自动执行优先使用 xs/s/m。" },
            "maxFiles": { "type": "integer", "minimum": 1, "description": "建议最大改动文件数。" },
            "maxEstimatedMinutes": { "type": "integer", "minimum": 5, "description": "预估最大执行分钟数。" }
          }
        },
        "retryPolicy": {
          "type": "object",
          "required": ["maxAttempts"],
          "additionalProperties": false,
          "description": "自动重试策略。超过次数后建议标记 needs_human。",
          "properties": {
            "maxAttempts": { "type": "integer", "minimum": 1, "description": "最大自动尝试次数。" }
          }
        },
        "lastIssue": { "$ref": "#/$defs/lastIssue" },
        "humanNotes": { "type": "string", "description": "人工补充说明。", "default": "" }
      }
    },
    "criterion": {
      "type": "object",
      "required": ["id", "text", "verification"],
      "additionalProperties": false,
      "properties": {
        "id": { "type": "string", "description": "验收标准 ID。" },
        "text": { "type": "string", "minLength": 1, "description": "验收标准描述。" },
        "verification": { "type": "string", "minLength": 1, "description": "如何验证该标准。" }
      }
    },
    "check": {
      "type": "object",
      "required": ["id", "name", "type", "required"],
      "additionalProperties": false,
      "properties": {
        "id": { "type": "string", "description": "检查 ID。" },
        "name": { "type": "string", "description": "检查名称。" },
        "type": { "type": "string", "enum": ["build", "lint", "typecheck", "unit", "api", "e2e", "health", "command", "http", "manual"], "description": "检查类型。command 使用本地命令，http 使用结构化接口检查，manual 只生成待人工验证项。" },
        "baseId": {
          "anyOf": [
            { "type": "string", "pattern": "^[a-z0-9][a-z0-9-]*$" },
            { "type": "null" }
          ],
          "description": "检查所属项目内子项目 ID。跨端检查可为空。"
        },
        "command": { "type": "string", "description": "检查命令。type 为 command/build/lint/typecheck/unit/e2e/health 时使用。" },
        "http": {
          "type": "object",
          "description": "结构化 HTTP 检查配置。用于表达 401、404、关闭鉴权后的接口连通性等检查。",
          "required": ["method", "url", "expectedStatus"],
          "additionalProperties": false,
          "properties": {
            "method": { "type": "string", "enum": ["GET", "POST", "PUT", "DELETE", "PATCH"] },
            "url": { "type": "string", "minLength": 1 },
            "headers": {
              "type": "object",
              "additionalProperties": { "type": "string" },
              "default": {}
            },
            "body": {
              "description": "请求体。由具体 runner 决定如何序列化。",
              "type": ["object", "array", "string", "number", "boolean", "null"]
            },
            "expectedStatus": { "type": "integer", "minimum": 100, "maximum": 599 },
            "authMode": {
              "type": "string",
              "enum": ["default", "anonymous", "authenticated", "auth_disabled"],
              "default": "default",
              "description": "鉴权模式。auth_disabled 只允许在 dev/test 环境使用，并且必须有恢复策略。"
            },
            "tokenEnv": {
              "type": "string",
              "minLength": 1,
              "description": "authenticated 检查使用的 token 环境变量名。"
            },
            "authHeader": {
              "type": "string",
              "minLength": 1,
              "default": "Authorization",
              "description": "注入 token 的请求头名称。默认 Authorization。"
            },
            "authScheme": {
              "type": "string",
              "default": "Bearer",
              "description": "鉴权 scheme。默认 Bearer；空字符串表示直接使用 token。"
            },
            "environment": {
              "type": "string",
              "enum": ["dev", "test", "production", "unknown"],
              "default": "unknown",
              "description": "HTTP 检查执行环境。auth_disabled 只允许 dev/test。"
            },
            "expectedBody": {
              "type": "object",
              "description": "响应体断言。contains/notContains 做字符串包含判断，jsonFields 做简单点路径等值判断。",
              "additionalProperties": false,
              "properties": {
                "contains": {
                  "anyOf": [
                    { "type": "string" },
                    { "type": "array", "items": { "type": "string" } }
                  ]
                },
                "notContains": {
                  "anyOf": [
                    { "type": "string" },
                    { "type": "array", "items": { "type": "string" } }
                  ]
                },
                "jsonFields": {
                  "type": "object",
                  "additionalProperties": {
                    "type": ["string", "number", "integer", "boolean", "null", "object", "array"]
                  }
                }
              }
            },
            "setupCommands": {
              "type": "array",
              "description": "检查前命令。用于临时关闭鉴权等高风险操作时必须可审计。",
              "items": { "type": "string" },
              "default": []
            },
            "teardownCommands": {
              "type": "array",
              "description": "检查后命令。auth_disabled 场景必须恢复原配置。",
              "items": { "type": "string" },
              "default": []
            }
          },
          "allOf": [
            {
              "if": { "properties": { "authMode": { "const": "auth_disabled" } }, "required": ["authMode"] },
              "then": {
                "required": ["teardownCommands"],
                "properties": {
                  "teardownCommands": { "minItems": 1 }
                }
              }
            }
          ]
        },
        "manual": {
          "type": "object",
          "description": "人工检查说明。",
          "required": ["instruction"],
          "additionalProperties": false,
          "properties": {
            "instruction": { "type": "string", "minLength": 1 }
          }
        },
        "required": { "type": "boolean", "description": "是否必须通过。" }
      },
      "allOf": [
        {
          "if": {
            "properties": {
              "type": { "enum": ["build", "lint", "typecheck", "unit", "api", "e2e", "health", "command"] }
            },
            "required": ["type"]
          },
          "then": { "required": ["command"] }
        },
        {
          "if": { "properties": { "type": { "const": "http" } }, "required": ["type"] },
          "then": { "required": ["http"] }
        },
        {
          "if": { "properties": { "type": { "const": "manual" } }, "required": ["type"] },
          "then": { "required": ["manual"] }
        }
      ]
    },
    "lastIssue": {
      "type": "object",
      "required": ["type", "summary", "source", "createdAt"],
      "additionalProperties": false,
      "description": "最近一次异常摘要。用于循环结束后的异常清单。",
      "properties": {
        "type": { "type": "string", "description": "异常类型，例如 acceptance_mismatch、scope_change_required、check_error。" },
        "summary": { "type": "string", "description": "异常摘要。" },
        "source": { "type": "string", "enum": ["executor", "check", "reviewer", "orchestrator"], "description": "异常来源。" },
        "requiredDecision": { "type": "string", "description": "需要人工决策时填写。", "default": "" },
        "createdAt": { "type": "string", "format": "date-time", "description": "异常创建时间。" }
      }
    },
    "humanApproval": {
      "type": "object",
      "required": ["approved", "approvedBy", "approvedAt"],
      "additionalProperties": false,
      "properties": {
        "approved": { "type": "boolean", "description": "是否已人工确认。" },
        "approvedBy": { "type": ["string", "null"], "description": "确认人。" },
        "approvedAt": { "type": ["string", "null"], "format": "date-time", "description": "确认时间。" },
        "notes": { "type": "string", "description": "确认备注。", "default": "" }
      }
    }
  }
}
